{
  "id": "esp32-s3",
  "name": "ESP32-S3",
  "category": "mcu",
  "manufacturer": "Espressif",
  "package": "QFN-48",
  "description": "ESP32-S3 Wi-Fi + Bluetooth 5 LE MCU with AI acceleration",
  "datasheetUrl": "https://www.espressif.com/sites/default/files/documentation/esp32-s3_datasheet_en.pdf",
  "pins": [
    {"number": 1, "name": "GPIO0", "type": "gpio", "direction": "bidirectional", "voltage": "3.3V"},
    {"number": 2, "name": "GPIO1", "type": "gpio", "direction": "bidirectional", "voltage": "3.3V"},
    {"number": 3, "name": "GPIO2", "type": "gpio", "direction": "bidirectional", "voltage": "3.3V"},
    {"number": 4, "name": "GPIO3", "type": "gpio", "direction": "bidirectional", "voltage": "3.3V"},
    {"number": 5, "name": "GPIO4", "type": "gpio", "direction": "bidirectional", "voltage": "3.3V"},
    {"number": 6, "name": "GPIO5", "type": "gpio", "direction": "bidirectional", "voltage": "3.3V"},
    {"number": 7, "name": "GPIO6", "type": "gpio", "direction": "bidirectional", "voltage": "3.3V"},
    {"number": 8, "name": "GPIO7", "type": "gpio", "direction": "bidirectional", "voltage": "3.3V"},
    {"number": 9, "name": "GPIO8", "type": "gpio", "direction": "bidirectional", "voltage": "3.3V"},
    {"number": 10, "name": "GPIO9", "type": "gpio", "direction": "bidirectional", "voltage": "3.3V"},
    {"number": 11, "name": "GPIO10", "type": "gpio", "direction": "bidirectional", "voltage": "3.3V"},
    {"number": 12, "name": "GPIO11", "type": "gpio", "direction": "bidirectional", "voltage": "3.3V"},
    {"number": 13, "name": "GPIO12", "type": "gpio", "direction": "bidirectional", "voltage": "3.3V"},
    {"number": 14, "name": "GPIO13", "type": "gpio", "direction": "bidirectional", "voltage": "3.3V"},
    {"number": 15, "name": "GPIO14", "type": "gpio", "direction": "bidirectional", "voltage": "3.3V"},
    {"number": 16, "name": "GPIO15", "type": "gpio", "direction": "bidirectional", "voltage": "3.3V"},
    {"number": 17, "name": "GPIO16", "type": "gpio", "direction": "bidirectional", "voltage": "3.3V", "protocol": "UART"},
    {"number": 18, "name": "GPIO17", "type": "gpio", "direction": "bidirectional", "voltage": "3.3V", "protocol": "UART"},
    {"number": 19, "name": "GPIO18", "type": "gpio", "direction": "bidirectional", "voltage": "3.3V"},
    {"number": 20, "name": "GPIO19", "type": "gpio", "direction": "bidirectional", "voltage": "3.3V"},
    {"number": 21, "name": "GPIO20", "type": "gpio", "direction": "bidirectional", "voltage": "3.3V"},
    {"number": 22, "name": "GPIO21", "type": "gpio", "direction": "bidirectional", "voltage": "3.3V"},
    {"number": 23, "name": "GPIO38", "type": "input", "direction": "input", "voltage": "3.3V"},
    {"number": 24, "name": "GPIO39", "type": "input", "direction": "input", "voltage": "3.3V"},
    {"number": 25, "name": "GPIO40", "type": "gpio", "direction": "bidirectional", "voltage": "3.3V"},
    {"number": 26, "name": "GPIO41", "type": "gpio", "direction": "bidirectional", "voltage": "3.3V"},
    {"number": 27, "name": "GPIO42", "type": "gpio", "direction": "bidirectional", "voltage": "3.3V"},
    {"number": 28, "name": "GPIO43", "type": "gpio", "direction": "bidirectional", "voltage": "3.3V", "protocol": "UART"},
    {"number": 29, "name": "GPIO44", "type": "gpio", "direction": "bidirectional", "voltage": "3.3V", "protocol": "UART"},
    {"number": 30, "name": "GPIO45", "type": "gpio", "direction": "bidirectional", "voltage": "3.3V"},
    {"number": 31, "name": "GPIO46", "type": "input", "direction": "input", "voltage": "3.3V"},
    {"number": 32, "name": "GPIO47", "type": "gpio", "direction": "bidirectional", "voltage": "3.3V"},
    {"number": 33, "name": "GPIO48", "type": "gpio", "direction": "bidirectional", "voltage": "3.3V"},
    {"number": 34, "name": "GPIO49", "type": "gpio", "direction": "bidirectional", "voltage": "3.3V"},
    {"number": 35, "name": "GPIO50", "type": "gpio", "direction": "bidirectional", "voltage": "3.3V"},
    {"number": 36, "name": "GPIO51", "type": "gpio", "direction": "bidirectional", "voltage": "3.3V"},
    {"number": 37, "name": "GPIO52", "type": "gpio", "direction": "bidirectional", "voltage": "3.3V"},
    {"number": 38, "name": "GPIO53", "type": "gpio", "direction": "bidirectional", "voltage": "3.3V"},
    {"number": 39, "name": "GPIO54", "type": "gpio", "direction": "bidirectional", "voltage": "3.3V"},
    {"number": 40, "name": "GPIO55", "type": "gpio", "direction": "bidirectional", "voltage": "3.3V"},
    {"number": 41, "name": "GPIO56", "type": "gpio", "direction": "bidirectional", "voltage": "3.3V"},
    {"number": 42, "name": "GPIO57", "type": "gpio", "direction": "bidirectional", "voltage": "3.3V"},
    {"number": 43, "name": "GPIO58", "type": "gpio", "direction": "bidirectional", "voltage": "3.3V"},
    {"number": 44, "name": "GPIO59", "type": "gpio", "direction": "bidirectional", "voltage": "3.3V"},
    {"number": 45, "name": "GPIO60", "type": "gpio", "direction": "bidirectional", "voltage": "3.3V"},
    {"number": 46, "name": "GPIO61", "type": "gpio", "direction": "bidirectional", "voltage": "3.3V"},
    {"number": 47, "name": "GPIO62", "type": "gpio", "direction": "bidirectional", "voltage": "3.3V"},
    {"number": 48, "name": "GPIO63", "type": "gpio", "direction": "bidirectional", "voltage": "3.3V"},
    {"number": 49, "name": "GPIO64", "type": "gpio", "direction": "bidirectional", "voltage": "3.3V"},
    {"number": 50, "name": "GPIO65", "type": "gpio", "direction": "bidirectional", "voltage": "3.3V"},
    {"number": 51, "name": "GPIO66", "type": "gpio", "direction": "bidirectional", "voltage": "3.3V"},
    {"number": 52, "name": "GPIO67", "type": "gpio", "direction": "bidirectional", "voltage": "3.3V"},
    {"number": 53, "name": "GPIO68", "type": "gpio", "direction": "bidirectional", "voltage": "3.3V"},
    {"number": 54, "name": "GPIO69", "type": "gpio", "direction": "bidirectional", "voltage": "3.3V"},
    {"number": 55, "name": "GPIO70", "type": "gpio", "direction": "bidirectional", "voltage": "3.3V"},
    {"number": 56, "name": "GPIO71", "type": "gpio", "direction": "bidirectional", "voltage": "3.3V"},
    {"number": 57, "name": "GPIO72", "type": "gpio", "direction": "bidirectional", "voltage": "3.3V"},
    {"number": 58, "name": "GPIO73", "type": "gpio", "direction": "bidirectional", "voltage": "3.3V"},
    {"number": 59, "name": "GPIO74", "type": "gpio", "direction": "bidirectional", "voltage": "3.3V"},
    {"number": 60, "name": "GPIO75", "type": "gpio", "direction": "bidirectional", "voltage": "3.3V"},
    {"number": 61, "name": "GPIO76", "type": "gpio", "direction": "bidirectional", "voltage": "3.3V"},
    {"number": 62, "name": "GPIO77", "type": "gpio", "direction": "bidirectional", "voltage": "3.3V"},
    {"number": 63, "name": "GPIO78", "type": "gpio", "direction": "bidirectional", "voltage": "3.3V"},
    {"number": 64, "name": "GPIO79", "type": "gpio", "direction": "bidirectional", "voltage": "3.3V"},
    {"number": 65, "name": "GPIO80", "type": "gpio", "direction": "bidirectional", "voltage": "3.3V"},
    {"number": 66, "name": "GPIO81", "type": "gpio", "direction": "bidirectional", "voltage": "3.3V"},
    {"number": 67, "name": "GPIO82", "type": "gpio", "direction": "bidirectional", "voltage": "3.3V"},
    {"number": 68, "name": "GPIO83", "type": "gpio", "direction": "bidirectional", "voltage": "3.3V"},
    {"number": 69, "name": "GPIO84", "type": "gpio", "direction": "bidirectional", "voltage": "3.3V"},
    {"number": 70, "name": "GPIO85", "type": "gpio", "direction": "bidirectional", "voltage": "3.3V"},
    {"number": 71, "name": "GPIO86", "type": "gpio", "direction": "bidirectional", "voltage": "3.3V"},
    {"number": 72, "name": "GPIO87", "type": "gpio", "direction": "bidirectional", "voltage": "3.3V"},
    {"number": 73, "name": "GPIO88", "type": "gpio", "direction": "bidirectional", "voltage": "3.3V"},
    {"number": 74, "name": "GPIO89", "type": "gpio", "direction": "bidirectional", "voltage": "3.3V"},
    {"number": 75, "name": "GPIO90", "type": "gpio", "direction": "bidirectional", "voltage": "3.3V"},
    {"number": 76, "name": "GPIO91", "type": "gpio", "direction": "bidirectional", "voltage": "3.3V"},
    {"number": 77, "name": "GPIO92", "type": "gpio", "direction": "bidirectional", "voltage": "3.3V"},
    {"number": 78, "name": "GPIO93", "type": "gpio", "direction": "bidirectional", "voltage": "3.3V"},
    {"number": 79, "name": "GPIO94", "type": "gpio", "direction": "bidirectional", "voltage": "3.3V"},
    {"number": 80, "name": "GPIO95", "type": "gpio", "direction": "bidirectional", "voltage": "3.3V"},
    {"number": 81, "name": "GPIO96", "type": "gpio", "direction": "bidirectional", "voltage": "3.3V"},
    {"number": 82, "name": "GPIO97", "type": "gpio", "direction": "bidirectional", "voltage": "3.3V"},
    {"number": 83, "name": "GPIO98", "type": "gpio", "direction": "bidirectional", "voltage": "3.3V"},
    {"number": 84, "name": "GPIO99", "type": "gpio", "direction": "bidirectional", "voltage": "3.3V"},
    {"number": 85, "name": "GPIO100", "type": "gpio", "direction": "bidirectional", "voltage": "3.3V"},
    {"number": 86, "name": "GPIO101", "type": "gpio", "direction": "bidirectional", "voltage": "3.3V"},
    {"number": 87, "name": "GPIO102", "type": "gpio", "direction": "bidirectional", "voltage": "3.3V"},
    {"number": 88, "name": "GPIO103", "type": "gpio", "direction": "bidirectional", "voltage": "3.3V"},
    {"number": 89, "name": "GPIO104", "type": "gpio", "direction": "bidirectional", "voltage": "3.3V"},
    {"number": 90, "name": "GPIO105", "type": "gpio", "direction": "bidirectional", "voltage": "3.3V"},
    {"number": 91, "name": "GPIO106", "type": "gpio", "direction": "bidirectional", "voltage": "3.3V"},
    {"number": 92, "name": "GPIO107", "type": "gpio", "direction": "bidirectional", "voltage": "3.3V"},
    {"number": 93, "name": "GPIO108", "type": "gpio", "direction": "bidirectional", "voltage": "3.3V"},